2.21,6.97,,Parker's problem with intimacy
2.21,6.97,,turns out to be that he can't get enough of it.
7.05,9.57,,Previously on "Buffy the Vampire Slayer":
11.73,14.65,,I've forgotten my manners
11.73,14.65,,in all the concussion. I'm Riley.
14.73,16.8,,I'm a TA. I'll be helping the professor out.
16.89,20.04,,I'm Professor Walsh.
16.89,20.04,,The Evil Bitch Monster of Death."
20.13,23.33,,Cos the Big Bad is back. And this time...
27.02,31.07,,Advertise your product or brand here
27.02,31.07,,contact www.OpenSubtitles.org today
34.37,38.45,,"Women. Young, nubile, exciting."
38.53,41.53,,Each one a mystery waiting to be unlocked.
42.41,47.33,,Think any of 'em are gonna show?
42.41,47.33,,Cos the party'd be lame if we lack for hotties.
47.41,50.13,,Professor? You with me?
50.21,54.33,,No. I'm with this large pile of
50.21,54.33,,"ungraded papers, due at three o'clock."
54.41,58.09,,How are you gonna learn anything
54.41,58.09,,if you keep doing schoolwork?
58.17,62.61,,Check her out. Is she hot or is she hot?
65.25,67.32,Riley ,She's Buffy.
67.41,70.41,Forrest ,Buffy? I like that.
70.49,73.64,Forrest ,"That girl's so hot, she's buffy."
73.73,75.37,Riley ,"It's her name, Forrest."
75.37,77.73,Forrest ,You've established first contact?
77.81,80.46,Forrest ,Excellent! What do you think of her?
80.46,82.81,Riely ,I never really thought about it.
82.89,85.85,Forrest ,A girl that cute in the face
82.89,85.85,Forrest ,and you form no opinion?
85.93,90.77,Riley ,"No, I mean... She's all right, I guess."
85.93,90.77,Riley ,She's just kinda... I don't know.
91.85,93.57,Forrest ,Peculiar.
91.85,93.57,Forrest ,Peculiar?
93.97,95.8,Forrest ,Yeah.
99.33,103.72,Forrest ,"Hey, Graham, what do you think of"
99.33,103.72,Forrest ,"the blonde chick? Mattressable, n'estce pas?"
103.81,106.17,Forrest ,Riley's not down. He doesn't like her.
106.57,111.49,Riley ,I don't dislike her. She never feels like
106.57,111.49,Riley ,she's really there when you talk to her.
111.57,115.24,Riley ,I like girls I can get a grip on.
115.24,117.02,Forrest ,I'll bet you do.
115.09,118.61,Riley ,Not that way. Just a little less
115.09,118.61,Riley ,ready for takeoff all the time.
118.69,121.4,Riley ,There's definitely something off about her.
121.4,122.73,Graham ,Maybe she's Canadian.
123.25,126.77,Forrest ,Didn't she go with Parker Abrams
123.25,126.77,Forrest ,for about 30 seconds?
126.85,129.45,Riley ,"Yeah, there's a sign of good taste!"
129.53,132.97,Forrest ,"OK, but you've got to admit,"
129.53,132.97,Forrest ,she's a majorleague hottie.
133.05,137.17,Riley ,"Well, I'm not denying she's easy on the eyes."
133.05,137.17,Riley ,I'm just saying...
139.01,141.32,Forrest ,Would you really wanna go out with her?
141.41,145.57,Forrest ,"Hell, yes. I bet a lot of guys"
141.41,145.57,Forrest ,would like to get their hands on her.
145.65,147.64,Spike ,The Slayer.
149.13,151.12,Spike ,Gonna kill you.
153.09,155.08,Spike ,Not so tough.
156.41,158.4,Spike ,Kill Slayer.
257.61,260.29,Giles ,"Well, based on Buffy's description,"
260.37,264.16,Giles ,I believe the men that we're after
260.37,264.16,Giles ,look something like...
265.09,269.02,Xander ,like this.
268.97,273.36,Xander ,The latest in fall fascism. I like it.
268.97,273.36,Xander ,A bit full in the hips for my taste.
273.45,278.73,Giles ,I think we can safely assume they're human.
273.45,278.73,Giles ,"So, no research needed."
278.81,283.44,Xander ,No study? Damn! Next thing you'll tell me
278.81,283.44,Xander ,is I'll have to eatjelly doughnuts
283.53,288.08,Xander ,or sleep with a supermodel to get
283.53,288.08,Xander ,things done. How much can one man give?
288.17,294.12,Giles ,"Not too much, I'm afraid. Once again I'd say"
288.17,294.12,Giles ,you and I will not be needed to help Buffy.
295.33,296.85,Xander ,Really?
295.33,296.85,Xander ,Really.
297.57,300.96,Xander ,How about this? We whip out
297.57,300.96,Xander ,"the Ouija board, light a few candles,"
301.09,306.77,Xander ,"summon some ancient, unstoppable evil:"
301.09,306.77,Xander ,mayhem. We show up and kick its ass.
311.57,312.96,Giles ,Wee bit unethical.
312.96,314.04,Buffy ,"Hello, people."
314.13,315.73,Buffy ,Hey.
317.01,319.05,Buffy ,It's my latenight stormtrooper pal.
319.05,320.16,Giles ,Just for reference.
320.25,322.2,Giles ,"But fairly accurate, you'd say?"
322.2,323.21,Buffy ,That's your man.
323.29,326.49,Giles ,"Your man, actually."
323.29,326.49,Giles ,You are patrolling tonight?
326.57,329.17,Buffy ,Nope. I am going to a party tonight.
329.25,332.09,Buffy ,"Hopefully a ""no fighting,"
329.25,332.09,Buffy ,no biting" kinda deal.
332.17,334.53,Giles ,Somebody's gotta find out
332.17,334.53,Giles ,who these people are.
334.61,339.02,Buiffy ,"Giles, I live in a dorm now."
337.65,342.73,Buiffy ,"The girls in my hall wanna party, Willow"
337.65,342.73,Buiffy ,"needs cheering up, I'm going to take her."
342.81,344.31,Xander ,How's Will dealin'...
344.31,347.52,Buffy ,With the black hole of despair since Oz left?
347.61,349.76,Buffy ,She's dealing. I'm helping.
349.85,352.05,Buffy ,"It's hard, ergo party."
352.13,353.46,Buffy ,You two can take patrol.
353.46,354.85,Vampire ,"Now, if you'll excuse me,"
354.93,356.15,Vampire ,I need to go find
356.15,358.53,Buffy ,something slutty to wear tonight.
387.53,390.37,Vampire ,Don't drink it. It's drugged.
397.93,400.15,Spike ,"And who are you, mate?"
400.15,401.16,Vampire ,I'm a rat.
402.05,406.44,Vampire ,"I'm a lab rat, just like the others."
402.05,406.44,Vampire ,"They're gonna kill us, you know."
408.13,410.89,Spike ,How are they gonna do that?
408.13,410.89,Spike ,"Well, they starve you."
410.97,416.41,Vampire ,"And when you're ready to bite your own arm,"
410.97,416.41,Vampire ,they shoot out one of those packets.
416.49,419.53,Vampire ,"You drink, and the next thing you're gone."
422.57,425.88,Vampire ,And that's when they do the experiments.
425.88,427.12,Spike ,And "they" are?
427.21,433.02,Spike ,The government? Nazis?
427.21,433.02,Spike ,A major cosmetics company?
431.09,434.8,Vampire ,"Who cares? All I know is,"
431.09,434.8,Vampire ,one minute I'm running from the Slayer
434.89,437.45,Vampire ,and the next thing I'm here.
437.53,439.09,Vampire ,The Slayer!
439.17,441.24,Spike ,I knew it! I knew it!
441.33,446.02,Vamire ,She took apart my crew
441.33,446.02,Vamire ,and led me straight to these guys.
444.09,446.08,Spike ,"She set me up, too."
448.13,451.41,Spike ,I always worried what would happen
448.13,451.41,Spike ,when that bitch got funding.
451.49,453.88,Spike ,She's wised up a bit. Fine!
455.09,457.45,Spike ,I'll take her apart.
458.57,460.56,Spike ,I don't care how brilliant she is.
461.41,463.4,Buffy ,Stupid pen!
465.53,466.28,Buffy ,My notes!
466.28,468.37,Wilow ,Ballpoints can be tricky.
470.73,472.63,Willow ,That's all for today. Read chapters
472.63,474.2,Walsh,eight to eleven for tomorrow.
474.29,475.61,Willow ,Riley!
476.05,479.33,Willow ,I notice you left off a name today in roll call.
479.41,481.88,Willow ,Osbourne. Daniel Osbourne. Oz.
481.97,487.02,Riley ,He's not in this class any more.
481.97,487.02,Riley ,I hear he dropped out.
485.09,488.97,Willow ,"Well, you heard way wrong, then."
485.09,488.97,Willow ,He's not gone.
489.05,495.02,Willow ,He left temporarily to work out a few things.
493.09,498.12,Willow ,"I know that sounds lame in its vagueness,"
493.09,498.12,Willow ,"but, I assure you, Oz will be back."
498.89,501.28,Walsh,"Not to my class, he won't."
502.69,506.81,Walsh,"An educated guess. You know the rules,"
502.69,506.81,Walsh,"you know I hate exceptions,"
506.89,510.44,Walsh,and yet somehow you feel
506.89,510.44,Walsh,your exception is exceptional.
510.53,511.35,Willow ,But...
511.35,513.25,Walsh ,It is. To you.
513.33,518.25,Walsh ,But since I'm neither a freshman nor a
513.33,518.25,Walsh ,"narcissist, I have to consider the whole class."
518.33,523.53,Walsh ,"If your friend can't respect my schedule,"
518.33,523.53,Walsh ,I think it's best he not come back.
530.33,535.73,Buffy ,"You know, for someone who teaches human"
530.33,535.73,Buffy ,"behaviour, you might try showing some."
535.81,538.49,Walsh ,It's not my job to coddle my students.
538.93,543.32,Buffy ,You're right. A human being in pain
538.93,543.32,Buffy ,has nothing to do with yourjob.
552.01,553.72,Walsh ,I like her.
553.72,554.81,Rirley ,Really?
557.41,560.17,Rirley ,You don't think she's a little peculiar?
562.13,566.92,Xander ,Here we go. Gear for tonight. If commando
562.13,566.92,Xander ,"squads are out there, fully loaded,"
567.01,570.29,Xander ,these babies might give us
567.01,570.29,Xander ,the edge we'll need.
570.37,574.45,Giles ,It's a very impressive array.
570.37,574.45,Giles ,Where did it all come from?
574.53,577.81,Xander ,Requisitioned it.
574.53,577.81,Xander ,Back when I was Military Guy.
579.73,582.93,Giles ,That was two years ago.
579.73,582.93,Giles ,You still 100 per cent?
583.01,586.13,Xander ,Are you kidding?
583.01,586.13,Xander ,I put the semper in semper fi.
586.73,590.28,Xander ,I might not be able to assemble an M16
586.73,590.28,Xander ,blindfolded like I used to
590.37,593.76,Xander ,or pass weapons drill
590.37,593.76,Xander ,for the mobile infantry...
596.01,601.25,Xander ,Might as well face it. Right now I don't have
596.01,601.25,Xander ,the technical skills to join the Swiss army.
601.33,603.09,Xander ,And all those guys ask you to do
603.09,605.17,Giles ,is uncork a couple of sassy Cabernets.
605.25,607.81,Giles ,I'm sure you'll be ready when the time comes.
607.89,612.73,Xander ,"Fear not. Handtohand, I'm still the man."
607.89,612.73,Xander ,"Whoever these guys trained with,"
612.81,615.83,Xander ,I'm sure they're not ready to deal with...
615.83,616.33,Xander's Mother ,Xander!
616.41,617.48,Xander ,"Yes, Mom?"
617.57,622.36,Xander's Mother ,I made a nice fruit punch for you
617.57,622.36,Xander's Mother ,and your friend. Would you boys like some?
624.21,627.41,Giles ,Is it raspberry fruit punch?
627.49,631.45,Riley ,So she says "You teach human behaviour.
627.49,631.45,Riley ,Maybe you oughta show some."
631.53,634.15,Forrest ,You're lying. She says it to Walsh?
634.15,635.05,Riley ,Hope to die.
635.13,639.09,Forrest ,Doesn't lack for guts. Gotta give her that.
639.09,641.02,Riley ,"Yeah, but she's nuts."
639.09,642.48,Forrest ,Come on. Like you never wanted
639.09,642.48,Forrest ,"to tell the professor off. Hey, Parker!"
642.57,644.29,Parker ,"Forrest. What's up, man?"
644.37,647.29,Forrest ,What's the scoop on Buffy Summers?
644.37,647.29,Forrest ,Is she cool?
647.37,650.92,Parker ,"Buffy? She's all right, I guess. Kinda whiny."
651.01,652.01,Forrest ,How's that?
652.01,654.09,Parker ,"Well, you know, clingy."
654.17,657.32,Parker ,"I mean, we got a little physical, well..."
657.41,661.93,Parker ,"Fully physical, and then she's all over me,"
657.41,661.93,Parker ,"you know, like we're betrothed or something."
662.01,663.97,Forrest ,"No, but fun was had, yeah?"
665.53,668.53,Parker ,"Oh, yeah. The word is stamina."
669.41,673.53,Parker ,"Definitely a bunny in the sack,"
669.41,673.53,Parker ,"but later on, well..."
673.61,677.13,Parker ,You know the difference between
673.61,677.13,Parker ,a freshman girl and a toilet seat?
677.21,680.09,Parker ,The toilet seat doesn't
677.21,680.09,Parker ,follow you around after you use it.
682.85,684.27,Riley ,I can't believe I did that.
684.27,685.32,Forrest ,Welcome to the club.
685.41,688.72,Forrest ,Know how much trouble you could get into?
685.41,688.72,Forrest ,If Parker reported you...
688.81,690.96,Graham ,He won't. He's too embarrassed.
690.96,691.65,Riley ,I hit him.
691.73,693.05,Forrest ,What the hell for?
693.05,695.04,Riley ,He was just being so crude.
695.13,697.85,Forrest ,Please! You've heard me say
695.13,697.85,Forrest ,much grosser things.
697.93,701.05,Riley ,"Yeah, most of those"
697.93,701.05,Riley ,are about your own mother.
701.13,703.12,Forrest ,"What is it, then?"
706.29,710.89,Riley ,I just didn't like hearing him talk
706.29,710.89,Riley ,about Buffy that way. I think that...
712.29,714.44,Riley ,"Well, I guess I like her."
714.53,717.33,Forrest ,You're kinda like a moron.
717.41,720.8,Riley ,"So, you knew that I had feelings for her?"
720.89,724.09,Forrest ,"Everybody knows, man."
720.89,724.09,Forrest ,She's peculiar"?
724.17,726.61,Forrest ,"Dead giveaway, buddy."
726.69,728.86,Riley ,I'm always the last to know.
728.86,730.48,Forrest ,So what you gonna do?
731.33,733.93,Riley ,"Well, I guess I'm gonna go see a girl."
762.33,765.33,Spike ,"Sorry, can't stay. Got to go see a girl."
779.61,781.13,Spike ,Get the serum!
781.13,782.33,Vampire ,Let me out!
782.41,783.52,Spike ,Bit busy right now.
783.52,784.97,Vampire ,I know where the exit is.
785.05,788.44,Vampire ,"You spring me, you're free."
785.05,788.44,Vampire ,"You don't, you're dead."
800.61,803.05,Vampire ,Hurry! Hurry!
809.93,811.92,Vampire ,This way!
821.89,827.02,Spike ,New plan  we split up. You go that way.
837.73,839.09,Willow ,Come in.
841.97,844.04,Willow ,Riley. Hi.
841.97,844.04,Willow ,Hi.
844.89,848.68,Riley ,"Gee, I hope I'm not interrupting"
844.89,848.68,Riley ,anything really depressing.
851.53,853.52,Willow ,What's up?
854.81,857.2,Riley ,Right to the point. OK.
860.97,863.93,Riley ,I was thinking of asking out Buffy.
864.01,865.69,Willow ,She's not here.
865.69,866.48,Riely ,I know.
866.57,872.81,Riely ,"See, I don't know that much about Buffy, but"
866.57,872.81,Riely ,"I'm interested in what she likes and, so far,"
872.89,876.85,Riely ,"well, the only thing"
872.89,876.85,Riely ,that I know she likes is you.
877.57,879.56,Willow ,What do you want me to do?
880.81,883.81,Riely ,Just tell me something. Anything.
884.29,887.6,Riely ,Just give me a clue to...
884.29,887.6,Riely ,"Here, let me help you with that."
888.89,891.04,Riely ,Just something that'll start us talking.
891.13,895.33,Riely ,I'm thinking that "How about them Broncos?"
891.13,895.33,Riely ,won't really cut it.
896.73,902.17,Willow ,OK. Say that I help and you start
896.73,902.17,Willow ,a conversation. It goes great.
902.25,904.56,Willow ,"You like Buffy, she likes you."
904.65,908.25,Willow ,"You spend time together,"
904.65,908.25,Willow ,feelings grow deeper.
908.33,914.02,Willow ,"And one day, without even realising it,"
908.33,914.02,Willow ,you find you're in love.
912.09,918.25,Willow ,Time stops and it feels like the whole world's
912.09,918.25,Willow ,made for you two and you two alone.
918.33,922.04,Willow ,Until one of you leaves and rips
918.33,922.04,Willow ,"the stillbeating heart from the other,"
922.13,926.13,Willow ,"who's now a broken, hollow"
922.13,926.13,Willow ,mockery of the human condition.
928.17,930.16,Riley ,"Yep, that's the plan."
930.81,933.2,Willow ,I figured it was.
934.09,936.81,Riley ,"Look, if you wanna tell me"
934.09,936.81,Riley ,"to go to hell, that's OK."
936.89,939.65,Riley ,Maybe this is the last thing
936.89,939.65,Riley ,you wanna talk about.
939.73,944.2,Riley ,"I just feel that... well, I've never"
939.73,944.2,Riley ,courted anyone like Buffy before.
944.29,948.08,Riley ,I don't think I've ever met
944.29,948.08,Riley ,anyone like Buffy before.
948.17,950.56,Willow ,Why should I trust you?
951.81,955.12,Riley ,Just sort of hoping
951.81,955.12,Riley ,you'd think I have an honest face.
955.21,959.89,Willow ,I've seen honest faces before.
955.21,959.89,Willow ,They usually come attached to liars.
961.57,965.02,Riley ,All right.
964.73,967.61,Riley ,I guess I'm not gonna win here.
967.69,971.08,Riley ,I appreciate you wanting
967.69,971.08,Riley ,to protect your friend.
971.65,974.65,Riley ,I guess she kinda brings that out in people.
979.01,981.4,Willow ,She likes cheese.
981.49,983.17,Riley ,What?
983.25,991.02,Riley ,"Well, I'm not saying it's the key to her heart,"
983.25,991.02,Riley ,but Buffy likes cheese.
990.97,993.25,Riley ,That's a start.
993.33,997.04,Willow ,"She has a stuffed piggy named Mr Gordo,"
997.17,999.97,Willow ,"Ioves Ice Capades, without the irony,"
1000.09,1003.64,Willow ,and she's dragging me
1000.09,1003.64,Willow ,to this party tonight at Lowell House.
1003.73,1006.85,Riley ,You're going? That's my house. I live there.
1006.93,1010.81,Willow ,"Well, it'll give you a chance to interact,"
1006.93,1010.81,Willow ,but don't get fresh.
1010.89,1014.09,Riely ,Fresh? Don't even know
1010.89,1014.09,Riely ,if we like each other yet.
1018.21,1024.02,Riely ,Does she ever talk about me?
1018.21,1024.02,Riely ,"Like, has she ever said any..."
1023.09,1023.87,Willow ,Sorry.
1023.87,1026.45,Riley ,That's discouraging.
1027.57,1030.17,Riley ,"Still, I feel like I have a fighting chance,"
1030.17,1031.53,Willow ,with my new accomplice.
1031.61,1032.93,Willow ,I'm not your accomplice.
1032.93,1033.92,Riley ,"No, of course not."
1034.01,1034.58,Willow ,I'm not.
1034.58,1035.37,Riley ,You're not.
1035.45,1037.28,Willow ,We're clear?
1035.45,1037.28,Willow ,We're clear.
1050.73,1052.63,Harmony ,"Spike, is that really you?"
1052.63,1053.65,Spike ,"It's me, baby."
1053.73,1055.72,Harmony ,Your man is...
1056.13,1057.85,Spike ,back.
1056.13,1057.85,Spike ,Bastard!
1057.93,1061.4,Harmony ,You dumped me and staked me
1057.93,1061.4,Harmony ,and hurt me and left me...
1061.49,1065.65,Spike ,"I know, sugar, but you're forgetting"
1061.49,1065.65,Spike ,one other thing I did.
1065.73,1067.28,Spike ,I missed you.
1067.28,1068.12,Harmony ,Really?
1073.25,1075.81,Harmony ,Just don't ever do that to me again.
1075.89,1080.65,Spike ,"Never, my little foam latte."
1075.89,1080.65,Spike ,Your blondie bear is here to stay.
1080.73,1083.67,Harmony ,"Well, where have you been? No, wait."
1083.67,1087.02,Spike ,Don't tell me. I'm just glad you're back.
1085.09,1089.85,Spike ,"And this time it's for good, right?"
1085.09,1089.85,Spike ,"For ever and ever, mon petite crème brûlée."
1090.21,1092.2,Harmony ,Ooh! Italian!
1093.41,1095.8,Spike ,Yeah. And get used to it.
1095.89,1100.21,Spike ,Big Daddy's home. We're gonna go
1095.89,1100.21,Spike ,"wherever you want, do whatever you want,"
1100.29,1102.68,Spike ,kill whoever you want.
1103.41,1105.77,Spike ,Starting with the Slayer.
1105.85,1109.37,Spike ,"And after that it's all you and me,"
1109.45,1113.41,Spike ,my little mentholated pack of smokes.
1113.49,1116.41,Harmony ,"Spiky, let's leave the Slayer alone."
1116.49,1120.69,Harmony ,You know she'll only slap you around.
1116.49,1120.69,Harmony ,And I can do that.
1120.77,1124.61,Xander,"No, see... The head, love."
1120.77,1124.61,Xander,Watch the head. Watch it!
1124.69,1129.37,Xander,Every man faces this moment. Here. Now.
1129.45,1133.49,Xander,"Watching, waiting for"
1129.45,1133.49,Xander,an unseen enemy that has no face.
1133.57,1138.41,Xander,Nerve endings screaming in silence. Never
1133.57,1138.41,Xander,knowing which thought might be your last.
1138.49,1141.17,Giles ,Shut up.
1151.65,1154.17,Buffy ,Looks cool.
1157.65,1159.43,Buffy ,"Look, we could go."
1159.43,1160.12,Willow ,"No, no."
1160.21,1162.2,Willow ,We're here for fun.
1163.33,1166.13,Buffy ,"Look, some of the guys are here already."
1166.21,1169.41,Willow ,I'm gonna grab a soda. I'll find you guys.
1170.77,1172.76,Buffy ,OK.
1184.01,1186.61,Willow ,She's wearing the halter top
1184.01,1186.61,Willow ,with sensible shoes.
1186.69,1189.41,Willow ,"So mostly dancing, light contact."
1186.69,1189.41,Willow ,Don't push your luck.
1189.49,1192.49,Willow ,Heavy conversation's out of the question.
1192.57,1194.16,Riley ,So what do I do?
1194.16,1195.85,Willow ,Ask her to dance.
1195.93,1197.92,Riley ,Right. Dance.
1198.61,1201.33,Riley ,Wait. No.
1201.41,1203.17,Willow ,What's the matter?
1203.17,1204.53,Riley ,I can't dance.
1205.49,1209.37,Williow ,Then talk. Keep eye contact.
1205.49,1209.37,Williow ,"Funny is good, but don't be glib."
1209.45,1213.69,Williow ,"And remember, if you hurt her,"
1209.45,1213.69,Williow ,I will beat you to death with a shovel.
1214.53,1218.21,Williow ,A vague disclaimer is nobody's friend.
1214.53,1218.21,Williow ,Have fun!
1229.45,1231.44,Riely ,Excuse me.
1233.29,1235.12,Buffy ,Hi.
1233.29,1235.12,Buffy ,Hi.
1238.65,1240.45,Riley ,Buffy...
1244.77,1248.48,Riley ,You do the reading on chapter nine?
1249.13,1251.12,Riley ,"Wow. Some theories, huh?"
1254.73,1257.17,Riley ,Cheese?
1260.09,1262.48,Riley ,"Fine, let's split up. I don't care."
1283.05,1284.81,Xander ,Harmony.
1284.89,1285.47,Harmony ,Xander?
1285.47,1287.12,Xander ,That's close enough.
1288.33,1294.02,Xander ,"I'm warning you, I've been highly trained"
1288.33,1294.02,Xander ,to put this through your heart.
1292.09,1294.37,Xander ,"No mercy, no warning."
1294.45,1296.81,Harmony ,I can kill you where you stand.
1297.85,1300.08,Xander ,"Bring it on, then."
1306.33,1308.32,Harmony ,You sissy kicker!
1325.25,1327.32,Xander ,Cut it out!
1327.41,1329.69,Harmony ,I'm so gonna bite you!
1329.77,1332.14,Xander ,"OK, stop, stop! We should stop, OK?"
1332.14,1333.69,Harmony ,"OK, I will if you will."
1333.77,1335.84,Harmony ,On the count of three.
1335.93,1339.4,Harmony ,"One, two, three!"
1344.33,1346.32,Harmony ,Right! OK.
1347.25,1349.24,Xander ,It's been great catching up.
1349.33,1352.48,Xander ,I'm gonna pick up the tattered shreds
1349.33,1352.48,Xander ,of my dignity and go home.
1352.57,1355.88,Xander ,Leaving you with your fire.
1355.97,1358.85,Harmony ,"My fire? Yeah, right!"
1358.93,1361.65,Harmony ,Like I'd listen to the Sex Pistols.
1363.05,1365.85,Harmony ,This crap belongs to Spike.
1365.93,1367.97,Xander ,Spike?
1368.05,1374.02,Harmony ,Can you believe him? He comes back
1368.05,1374.02,Harmony ,with all these big promises.
1372.09,1374.16,Harmony ,"Not that I believed him, you know."
1374.25,1378.72,Harmony ,"He could have spent one night, but, no,"
1374.25,1378.72,Harmony ,"everything was ""Slayer this"", ""Slayer that""."
1378.81,1382.25,Harmony ,He probably already killed her.
1378.81,1382.25,Harmony ,"I'm not taking him back,"
1382.33,1385.33,Harmony ,I just wanna know
1382.33,1385.33,Harmony ,why it is that men always...
1386.77,1388.37,Harmony ,leave.
1400.17,1402.97,Riley ,I can't believe it. I choked.
1404.37,1406.68,Willow ,"You really, really did."
1406.77,1410.13,Riley ,You don't understand.
1406.77,1410.13,Riley ,I'm good at things. That's what I do.
1410.21,1415.02,Riley ,"I work hard, apply myself. Get it done."
1413.09,1415.37,Willow ,"Well, you failed extremely well."
1415.45,1418.21,Riley ,That's a great comfort to me.
1420.69,1423.89,Willow ,You need to relax. You're not proposing.
1424.25,1427.21,Willow ,"You're just making contact,"
1424.25,1427.21,Willow ,getting a reaction.
1427.29,1429.44,Willow ,Any reaction is OK
1429.53,1433.85,Willow ,"except projectile vomiting,"
1429.53,1433.85,Willow ,but what are the chances of that?
1436.37,1441.02,Riley ,Are you OK?
1439.09,1441.13,Willow ,This song.
1441.21,1448.02,Riley ,"Yeah, it's a tape of some bands"
1441.21,1448.02,Riley ,from last year's party. Associations?
1447.09,1448.73,Willow ,Big.
1449.09,1450.85,Riley ,Bad?
1453.73,1455.33,Riley ,AJ.
1460.29,1464.02,Willow ,Thank you.
1462.09,1464.29,Willow ,Now go find Buffy.
1464.73,1468.77,Riley ,"There's no hurry. I mean, if you wanna talk."
1464.73,1468.77,Riley ,No.
1468.85,1473.17,Willow ,I want you to find Buffy and tell her that
1468.85,1473.17,Willow ,I went home and not to worry about me.
1473.25,1476.25,Willow ,Which at least will give you
1473.25,1476.25,Willow ,something to say.
1479.01,1480.73,Riley ,Thanks.
1480.81,1482.8,Willow ,You'll do fine.
1494.65,1497.37,Riley ,Willow said to say that she took off.
1497.45,1501.37,Riley ,"She's OK. Kinda blue,"
1497.45,1501.37,Riley ,but she said not to worry.
1502.09,1503.89,Buffy ,Thank you.
1504.93,1507.74,Riley ,"You know, I wanted to ask you somethin'."
1507.74,1508.37,Buffy ,Ask away.
1509.09,1512.88,Xander ,Buffy! I've been looking
1509.09,1512.88,Xander ,all over for you. We need...
1512.97,1518.17,Xander ,We need to talk. Not here.
1512.97,1518.17,Xander ,It's sort of unfinished business.
1518.25,1520.16,Buffy ,Business? Right.
1520.25,1522.32,Buffy ,Excuse us.
1522.41,1524.17,Riley ,No problem.
1526.81,1528.85,Forrest ,Denied.
1528.93,1533.32,Riley ,It's not like she blew me off.
1528.93,1533.32,Riley ,"She just left with another guy, that's all."
1533.41,1535.8,Forrest ,"We need you downstairs, anyway."
1538.89,1542.68,Forrest ,"I hate to say it, but they're probably"
1538.89,1542.68,Forrest ,"on their way to make crazy, naked sex."
1542.77,1543.85,Riley ,Is that necessary?
1543.85,1545.77,Forrest ,"Look, I'm protecting you, buddy."
1545.85,1548.85,Forrest ,I don't wanna see you
1545.85,1548.85,Forrest ,mooning over some freshman.
1548.93,1550.45,Computer,Retinal scan accepted.
1550.45,1552.81,Graham ,I like her. I'm on your side here.
1552.89,1558.65,Riley ,"I know you are, Graham. That's what gives me"
1552.89,1558.65,Riley ,the strength to put up with this comedian.
1563.25,1568.02,Forrest ,"Dude, a straight tip: I know about girls."
1566.09,1568.16,Riley ,"Exactly. Girls, plural."
1568.25,1570.32,Riley ,I'm talking about one girl.
1570.41,1572.17,Riley ,One girl.
1572.25,1576.45,Computer,Initiative vocal code match complete.
1572.25,1576.45,Computer,"Special Agent Finn, Riley."
1578.69,1581.84,Riley ,"The problem is, what kind of girl"
1578.69,1581.84,Riley ,is gonna go out with a guy
1581.93,1588.09,Riley ,who's acting all Joe Regular by day
1581.93,1588.09,Riley ,and then turns all demonhunter by night?
1588.17,1589.95,Graham,Maybe a peculiar one.
1589.95,1591.48,Riley,"Thank you, Graham."
1591.57,1596.57,Riley,"Sure, give him the gratitude"
1591.57,1596.57,Riley,when I'm the guy sparing you heartbreak.
1612.21,1615.44,Riley,She's a major babe.
1612.21,1615.44,Riley,"I still say you've got a shot, Rye."
1615.53,1619.53,Riley,"You see, Forrest?"
1615.53,1619.53,Riley,You don't have to be so negative all the time.
1619.61,1621.37,Riley,Hold up.
1621.45,1623.44,Riley,Situation?
