2.21,3.93,GILES VOICEOVER,Previously on "Buffy the Vampire Slayer":
4.01,8.05,GILES,You are the Slayer.
4.01,8.05,GILES,Into each generation a slayer is born.
8.13,10.04,BUFFY,"Let's start with ""Hi, I'm Buffy""."
10.04,10.44,XANDER,Xander.
10.53,11.12,CORDELIA,Cordelia.
11.12,11.57,BUFFY VOICEOVER,Willow?
11.65,12.61,GILES,Mr Giles.
12.61,13.25,ANGEL,Angel.
17.02,21.07,VAMP,Advertise your product or brand here
17.02,21.07,VAMP,contact www.OpenSubtitles.org today
63.57,66.17,VAMP,Gave me a pretty good run there.
66.25,68.24,VAMP,Bet the blood's just pumpin'.
70.21,71.58,VAMP,Bet it's hot.
71.58,73.05,KID,Don't hurt me.
73.81,75.77,VAMP,Don't hurt you?
77.65,79.45,BUFFY,What's going on?
80.73,82.69,KID,Help me. Call the police.
82.77,84.45,VAMP,"Get outta here, girl."
84.45,86.69,BUFFY,Are you guys havin' a fight?
86.77,89.24,BUFFY,"Cos, you know, fighting's not cool."
90.09,91.82,KID,Get out of here.
91.82,94.21,VAMP,"No, she wants to stay."
95.33,97.4,VAMP,I don't mind a little appetiser.
98.85,103.32,BUFFY,Have you ever heard the expression
98.85,103.32,BUFFY,Biting off more than you can chew"?
103.41,105.17,BUFFY,OK.
105.25,107.97,BUFFY,How about the expression "vampire slayer"?
108.05,110.1,VAMP,What the hell you talkin' about?
110.1,111.76,BUFFY,Wow. Never heard that one.
111.85,116.09,BUFFY,"OK. How about ""Oh, God, my leg""?"
119.05,121.25,VAMP,"Oh, God! My leg!"
121.85,124.08,BUFFY,See? Now we're communicating.
158.09,161.93,BUFFY,Wow. Been a long while since
158.09,161.93,BUFFY,I met one who didn't know me.
165.13,167.12,BUFFY,You should get home.
168.93,171.29,KID,How'd you do that?
171.29,173.25,BUFFY,It's what I do.
173.61,175.49,KID,But you're just a girl.
179.33,181.32,BUFFY,That's what I keep saying.
238.41,240.74,XANDER,Something goin' on out back?
240.74,241.41,BUFFY,Vampire.
243.45,244.86,BUFFY,Anything?
244.86,248.77,GILES,Nothing you want to hear.
248.85,251.36,GILES,The ritual is...
251.36,254.02,BUFFY,Explain it again.
252.09,253.78,GILES,There's nothing new to...
253.78,255.13,BUFFY,Go through it again.
262.49,264.53,GILES,The Key was living energy.
264.61,270.17,GILES,"It needed to be channelled, poured"
264.61,270.17,GILES,into a specific place at a specific time.
271.57,276.33,GILES,"The energy would flow into that spot, the"
271.57,276.33,GILES,walls between the dimensions break down.
276.41,279.72,GILES,"It stops, the energy's used up,"
276.41,279.72,GILES,the walls come back up.
280.29,283.17,GILES,Glory uses that time to get
280.29,283.17,GILES,"back into her own dimension,"
283.25,287.33,GILES,not caring that all manner of Hell will
283.25,287.33,GILES,be unleashed on Earth in the meantime.
289.09,294.33,ANYA,"But only for a little while, right?"
289.09,294.33,ANYA,"The walls come back, no more Hell?"
295.17,297.93,WILLOW,That's only if the energy is stopped.
298.01,303.33,WILLOW,"And now the key is human, is Dawn..."
305.21,310.92,GILES,"The blood flows, the gates will open."
305.21,310.92,GILES,The gates will close when it flows no more."
311.01,313.45,GILES,When Dawn is dead.
314.89,316.88,TARA,I have places to be.
321.41,324.61,XANDER,Why blood? Why Dawn's blood?
324.73,327.88,XANDER,"I mean, why couldn't it be a lymph ritual?"
327.97,331.09,SPIKE,Cos it's always got to be blood.
331.17,333.75,XANDER,We're not discussing dinner right now.
333.75,335.45,SPIKE,"Blood is life, lackbrain."
335.53,337.6,SPIKE,Why do you think we eat it?
337.69,342.56,SPIKE,It's what keeps you going.
337.69,342.56,SPIKE,Makes you warm. Makes you hard.
342.65,344.64,SPIKE,Makes you other than dead.
345.53,347.29,SPIKE,Course it's her blood.
348.37,352.41,BUFFY,Pretty simple math here. We stop
348.37,352.41,BUFFY,Glory before she can start the ritual.
352.49,354.27,BUFFY,We still have a couple of hours.
354.27,356.28,GILES,If my calculations are right. But...
356.37,357.54,BUFFY,I don't wanna hear it.
357.54,358.49,GILES,I understand that.
358.57,360.72,BUFFY,"No, you don't understand."
361.81,363.88,BUFFY,We are not talking about this.
363.97,366.73,GILES,"Yes, we bloody well are!"
372.01,376.09,GILES,"If Glory begins the ritual,"
372.01,376.09,GILES,if we can't stop her...
378.13,382.81,BUFFY,Come on. Say it.
378.13,382.81,BUFFY,We're bloody well talking about this.
384.09,386.08,BUFFY,Tell me to kill my sister.
387.77,390.37,GILES,She's not your sister.
392.09,394.65,BUFFY,No. She's not.
396.09,398.08,BUFFY,She's more than that.
398.85,401.61,BUFFY,She's me.
401.69,404.08,BUFFY,The monks made her out of me.
405.29,409.05,BUFFY,"I hold her, and I feel closer to her than..."
411.97,416.6,BUFFY,It's notjust the memories
411.97,416.6,BUFFY,they built. It's physical.
418.09,420.48,BUFFY,Dawn is a part of me.
421.97,423.8,BUFFY,The only part that I...
423.89,429.01,WILLOW,We'll solve this. We will.
423.89,429.01,WILLOW,"Don't have another coma, OK?"
431.29,435.84,GILES,"If the ritual starts, every living creature"
431.29,435.84,GILES,in this and every other dimension imaginable
435.93,438.81,GILES,will suffer unbearable torment and death.
440.13,444.02,GILES,Including Dawn.
442.37,445.68,BUFFY,Then the last thing she'll see
442.37,445.68,BUFFY,is me protecting her.
447.01,451.77,GILES,You'll fail. You'll die. We all will.
455.05,457.57,BUFFY,I'm sorry.
458.93,462.37,BUFFY,"I love you all, but I'm sorry."
467.05,468.39,BUFFY,OK. All in favour of
468.39,470.6,ANYA,stopping Glory before the ritual.
471.09,474.61,ANYA,Suggestions? Ideas? Time's awastin'.
474.69,476.57,SPIKE,When you say you love us all...
476.57,477.05,XANDER/GILES,Shut up.
477.13,481.73,ANYA,"Willow, I bet you've got some dark"
477.13,481.73,ANYA,spell abrewin'. Make her a toad?
481.81,484.12,ANYA,Little hoppy toad?
481.81,484.12,ANYA,We hit her with a hammer?
485.45,487.92,TARA,Hoppy toad.
490.33,492.48,XANDER,"What about Ben? He can be killed, right?"
492.57,496.09,XANDER,I know he's an innocent
492.57,496.09,XANDER,but not like Dawn innocent.
496.65,499.53,XANDER,We could kill a regular guy.
504.09,505.37,XANDER,God.
506.97,510.57,GILES,It's doubtful he'll surface again
506.97,510.57,GILES,this close to the ritual.
510.65,513.61,GILES,We can expect it's Glory we're dealing with.
513.69,518.24,WILLOW,We don't have to kill her. We just
513.69,518.24,WILLOW,have to stop her from doing the ritual.
518.33,521.25,WILLOW,There's only the one time
518.33,521.25,WILLOW,"that she can do it, right?"
521.33,525.04,SPIKE,"Yeah. We get her on the ropes,"
521.33,525.04,SPIKE,we keep her occupied till it's too late.
525.13,528.13,ANYA,OK. But I'm still not hearing enough ideas.
528.21,530.43,ANYA,She's a god. Let's think outside the box.
530.43,532.49,SPIKE,You go think outside the bleeding box.
532.57,537.6,GILES,"Yes, Anya. Apart from your uninfectious"
532.57,537.6,GILES,"enthusiasm, have you anything to contribu..."
537.69,539.91,ANYA,The Dagon Sphere.
539.91,540.69,GILES,Sorry?
541.01,542.61,ANYA,"When Buffy first met Glory,"
542.69,546.61,ANYA,she found that magical glowy sphere
542.69,546.61,ANYA,that was meant to repel Glory.
546.69,551.16,ANYA,We've got it in the basement.
546.69,551.16,ANYA,It might drive her away or hurt her.
552.21,555.65,ANYA,And Olaf the troll god's enchanted hammer.
555.73,558.2,ANYA,"You wanna fight a god,"
555.73,558.2,ANYA,use the weapon of a god.
558.57,560.61,SPIKE,Nah. That thing's too heavy to...
560.93,562.08,SPIKE,Yeah. Good.
562.17,563.97,BUFFY,I like this. Thanks.
563.97,566.21,ANYA,Here to help. Wanna live.
566.29,568.36,XANDER,Smart chicks are so hot.
569.85,573.16,WILLOW,You couldn't have
569.85,573.16,WILLOW,figured that out in tenth grade?
573.93,577.93,GILES,"Well, we have some ideas if we could"
573.93,577.93,GILES,"actually get Glory on the run, but..."
578.01,580.57,BUFFY,But we still have no idea how to find her.
580.65,585.09,TARA,Big day. It calls me. I have to be there.
586.65,588.17,TARA,Big day.
596.73,601.49,BEN,They said you have to
596.73,601.49,BEN,put this on for the ceremony.
604.73,606.61,DAWN,What if I don't?
607.05,608.05,BEN,Come on. Just...
608.05,610.05,DAWN,What if I don't like the colour?
610.13,613.84,BEN,"Look, I wish there was another way."
613.93,617.81,DAWN,And I wish you'd fall on your head
613.93,617.81,DAWN,"and drown in your own barf, so..."
617.89,620.49,DAWN,I guess we're both disappointed.
620.57,622.61,BEN,I think it'll be quick.
623.81,627.89,MINION,"Actually, sir, the bleeding is quite"
623.81,627.89,MINION,a slow process to give the portal time to...
627.97,630.49,BEN,Thank you for the information.
632.97,634.26,BEN,I'll do what I can...
634.26,634.69,DAWN,Change.
634.77,635.16,BEN,What?
635.16,638.48,DAWN,Change. Be her. I don't wanna look at you.
638.57,640.5,BEN,"Dawn, I don't think you wanna..."
640.5,641.04,DAWN,Be Glory.
641.93,644.32,DAWN,Be Glory.
645.73,648.25,BEN,Will you just stop... shouting already?
652.85,657.05,GLORY,"So, what's the hubbub, bub?"
652.85,657.05,GLORY,What do you got against old Benjy?
659.05,661.04,DAWN,He's a monster.
662.17,664.21,DAWN,At least you're upfront about it.
665.29,669.02,GLORY,Don't be so hard on the boy.
667.61,671.89,GLORY,He just wants to live.
667.61,671.89,GLORY,Most guys'd do the same.
671.97,677.49,GLORY,"Besides, he's probably the reason your sis"
671.97,677.49,GLORY,and her little cartoon pals are still alive.
677.57,682.44,GLORY,That little nagging pinch of humanity that
677.57,682.44,GLORY,makes me go for the hurt instead of the kill.
682.89,685.09,GLORY,Lowering myself
682.89,685.09,GLORY,to trade blows with the Slayer
685.17,688.32,GLORY,when I should have just
685.17,688.32,GLORY,put my fist through her heart.
688.41,690.4,GLORY,It's gotta be Ben.
690.49,692.77,DAWN,Or maybe you just can't take her.
698.73,700.8,GLORY,Funny thing.
698.73,700.8,GLORY,"You've been here a few hours,"
700.89,704.2,GLORY,and I haven't seen big sis
700.89,704.2,GLORY,galloping in to save you.
704.29,707.13,GLORY,She probably knows
704.29,707.13,GLORY,what a terrible mistake that'd be.
707.21,709.04,DAWN,She's not afraid of you.
709.13,712.68,GLORY,"No, sweetie, baby."
709.13,712.68,GLORY,I'm talking about the ritual.
713.89,719.89,GLORY,"Cos, you know, I bleed you,"
713.89,719.89,GLORY,"the portals open, but once you die they close."
719.97,723.12,GLORY,"The faster you die,"
719.97,723.12,GLORY,the better for your sorry species.
724.61,727.25,GLORY,I'm bettin' Buffy knows that.
727.33,732.04,GLORY,"Since she's not really your sister,"
727.33,732.04,GLORY,I'm guessin' she isn't gonna show.
733.05,736.65,GLORY,"And if she does, it might not be to save you."
743.85,745.84,DAWN,Buffy.
755.25,757.6,GILES,Sure you're not gonna tire yourself out?
757.6,758.13,BUFFY,I'm sure.
761.09,763.89,GILES,We're still working on ideas.
764.77,768.4,GILES,"Time's short, but best"
764.77,768.4,GILES,leave it to the last moment.
768.49,773.28,GILES,"If we go in too early and she takes us out,"
768.49,773.28,GILES,no chance of getting her to miss her window.
773.37,774.93,BUFFY,Then we wait.
779.17,781.32,GILES,I imagine you hate me right now.
789.33,791.47,GILES,I love Dawn.
791.47,792.72,BUFFY,I know.
792.81,795.17,GILES,But I've sworn to protect this sorry world.
795.25,801.2,GILES,Sometimes that means saying
795.25,801.2,GILES,and doing what other people can't.
803.13,805.17,GILES,What they shouldn't have to.
807.41,812.02,BUFFY,"You try and hurt her,"
807.41,812.02,BUFFY,and you know I'll stop you.
810.33,812.09,GILES,I know.
823.37,825.81,BUFFY,This is how many apocalypses for us now?
830.49,832.48,GILES,Six at least.
835.05,837.04,GILES,Feels like a hundred.
838.37,842.33,BUFFY,I've always stopped them. Always won.
842.41,844.4,GILES,Yes.
845.57,848.41,BUFFY,I sacrificed Angel to save the world.
850.01,854.02,BUFFY,I loved him so much.
853.69,857.24,BUFFY,But I knew what was right.
859.81,861.8,BUFFY,I don't have that any more.
863.37,865.36,BUFFY,I don't understand.
866.97,870.89,BUFFY,I don't know how to live in this world
866.97,870.89,BUFFY,if these are the choices.
872.45,874.89,BUFFY,"If everything just gets stripped away,"
877.17,879.16,BUFFY,I don't see the point.
880.61,882.6,BUFFY,I just wish...
887.13,889.57,BUFFY,I just wish my mom was here.
900.85,904.4,BUFFY,The spirit guide told me
900.85,904.4,BUFFY,that death is my gift.
905.85,909.32,BUFFY,Guess that means a slayer
905.85,909.32,BUFFY,really is just a killer after all.
910.09,912.36,GILES,I think you're wrong about that.
912.36,913.64,BUFFY,It doesn't matter.
914.37,917.21,,"If Dawn dies, I'm done with it."
918.49,920.88,,I'm quitting.
933.69,938.02,,Everything is prepared.
939.85,942.37,,"OK, campers, it's almost stab time."
942.45,945.25,,"You two, get her."
946.05,947.85,,No.
947.93,949.92,,Buffy!
952.09,953.21,GLORY,See you in a few.
978.21,980.81,GILES,Any luck? Have you
978.21,980.81,GILES,found the Dagon Sphere?
981.97,984.33,ANYA,I'm sure it's here. Just be a minute.
984.41,988.37,XANDER,"Yeah, we're on it. Let's look over here,"
984.41,988.37,XANDER,where we didn't look yet.
988.45,990.33,GILES,Time is a factor.
990.33,992.33,ANYA,Yes. Not to worry.
996.73,1000.41,XANDER,"So, are you more relaxed?"
1000.49,1002.13,ANYA,No.
1002.21,1008.48,XANDER,"No? I mean, it sounded like you arrived."
1008.57,1010.56,XANDER,No. Yes.
1011.21,1015.57,ANYA,"I had the pleasure moment, and"
1011.21,1015.57,ANYA,the blissful calm that comes right after it.
1015.65,1018.45,ANYA,But it lasted two seconds
1015.65,1018.45,ANYA,and now I'm terrified again.
1018.53,1020.52,XANDER,"Well, you don't have to be."
1022.65,1023.85,ANYA,What?
1024.61,1028.61,XANDER,Spike's sexbot. Why didn't they
1024.61,1028.61,XANDER,just melt it down into scrap?
1030.05,1032.04,ANYA,Maybe Willow wanted it.
1034.13,1036.6,XANDER,I don't think Willow feels
1034.13,1036.6,XANDER,that way about Buffy.
1036.69,1039.82,XANDER,"She's gone through a lot of changes, but..."
1039.82,1040.69,ANYA,To study it.
1040.77,1044.48,XANDER,Right. Robotics. Science.
1047.69,1048.47,ANYA,Pervert.
1048.47,1049.84,XANDER,Other pervert.
1050.53,1052.84,ANYA,And don't frighten me like that.
1053.85,1056.93,ANYA,"God, who would put"
1053.85,1056.93,ANYA,something like that there?
1057.01,1059.48,ANYA,Is this supposed to be
1057.01,1059.48,ANYA,some sort of sickjoke?
1059.57,1061.64,ANYA,"I mean, things aren't bad enough?"
1063.25,1064.4,ANYA,This is an omen.
1065.85,1067.29,ANYA,"No, it's an omen."
1067.37,1071.61,ANYA,"It's a higher power, telling me through"
1067.37,1071.61,ANYA,"bunnies that we're all gonna die. Oh, God."
1071.69,1074.49,XANDER,"No, it's not."
1074.57,1076.61,XANDER,It's OK.
1076.69,1080.89,ANYA,"No. You see, usually when"
1076.69,1080.89,ANYA,"there's an apocalypse, I skedaddle."
1080.97,1083.93,ANYA,But now I love you so much
1080.97,1083.93,ANYA,"I have inappropriately timed sex,"
1084.01,1091.02,ANYA,"try to think of ways to fight a god, and worry"
1084.01,1091.02,ANYA,"terribly that something might happen to you,"
1089.09,1091.08,ANYA,and also that something'll happen to me.
1091.17,1095.8,ANYA,I have guilt that I'm not more worried about
1091.17,1095.8,ANYA,"everyone else, but I just don't have enough."
1095.89,1102.21,ANYA,"I'm on total overload, and I don't think that"
1095.89,1102.21,ANYA,I could be more nervous than I am right now.
1102.29,1104.28,XANDER,Care to wager on that?
1111.01,1114.13,XANDER,"Anya, you wanna marry me?"
1119.69,1121.37,XANDER,Can I take that as a maybe?
1121.37,1122.81,ANYA,You're proposing to me.
1123.17,1124.21,XANDER,Yes.
1124.45,1126.73,ANYA,You're proposing to me cos we're gonna die.
1126.81,1129.12,ANYA,"And you think it's romantic and sexy,"
1129.21,1132.92,ANYA,and you know you won't have to go through
1129.21,1132.92,ANYA,with it cos the world's gonna end.
1133.01,1136.25,XANDER,"I'm proposing to you, Anya, because it's not."
1136.25,1137.69,ANYA,You can't know that.
1138.05,1141.84,XANDER,I believe it. And I think
1138.05,1141.84,XANDER,we're gonna get through this.
1143.33,1146.09,XANDER,"I think I'm gonna live a long and silly life,"
1146.17,1149.61,XANDER,and I'm not interested in
1146.17,1149.61,XANDER,doing that without you around.
1153.89,1157.12,ANYA,OK.
1153.89,1157.12,ANYA,OK?
1157.21,1161.09,ANYA,"Yes. I mean, yes."
1165.09,1167.53,ANYA,No.
1165.09,1167.53,ANYA,No?
1168.29,1169.28,ANYA,After.
1170.93,1173.85,ANYA,Give it to me when the world doesn't end.
1180.57,1182.43,BUFFY,What have you got for me?
1182.43,1184.36,WILLOW,"Some ideas. Well, notions."
1184.45,1187.49,WILLOW,Or theories based on wild speculation.
1187.57,1190.77,WILLOW,Did I mention I'm not good under pressure?
1190.85,1193.29,BUFFY,"I need you, Will. You're my big gun."
1193.37,1195.69,BUFFY,"I'm your... No, I was never a gun."
1195.69,1197.81,WILLOW,Someone else should be the gun.
1197.89,1201.2,WILLOW,I could be a cudgel. Or a pointy stick.
1202.49,1207.02,BUFFY,You're the strongest person here.
1205.09,1207.47,BUFFY,"You know that, right?"
1207.47,1207.81,WILLOW,No.
1207.89,1211.44,BUFFY,"Will, you're the only person"
1207.89,1211.44,BUFFY,that's ever hurt Glory. At all.
1212.53,1216.73,BUFFY,You're my best shot at getting her on the
1212.53,1216.73,BUFFY,"ropes, so don't get ajelly belly on me now."
1216.81,1220.81,WILLOW,"Well, I do sort of have this one idea."
1220.89,1225.97,WILLOW,"But, last few days, I've mostly been"
1220.89,1225.97,WILLOW,looking into ways to help Tara.
1226.05,1228.89,WILLOW,I know that shouldn't be my priority...
1229.93,1232.32,BUFFY,Of course it should.
1233.25,1236.33,WILLOW,"Well, I've been charting their essences."
1233.25,1236.33,WILLOW,Mapping out.
1236.41,1242.52,WILLOW,"I think, if I can get close enough,"
1236.41,1242.52,WILLOW,"I may be able to reverse what Glory did,"
1242.61,1245.17,WILLOW,take back what she took from Tara.
1245.25,1249.04,WILLOW,"It might weaken Glory,"
1245.25,1249.04,WILLOW,or make her less coherent.
1249.13,1251.36,WILLOW,Or it might make all our heads explode.
1251.65,1254.17,GILES,Buffy?
1254.77,1256.76,WILLOW,I'll try to work it.
1261.25,1263.89,WILLOW,"Don't worry, love. It won't be long."
1266.25,1269.25,TARA,Bitch. I'm supposed to work on the factors.
1271.25,1273.24,TARA,I'm not...
1278.57,1280.56,WILLOW,I'm gonna bring you back.
1283.49,1286.85,BUFFY,"No, that's good. That could be pivotal."
1286.93,1287.82,BUFFY,"Thank you, guys."
1287.82,1289.21,GILES,You're gonna need some...
1289.29,1290.95,BUFFY,Way ahead of you. We have time?
1290.95,1291.65,GILES,If you hurry.
1291.73,1293.77,BUFFY,OK. I'll grab some weapons too.
1293.85,1296.13,XANDER,I'm looking for something in a broadsword.
1296.13,1297.81,SPIKE,Don't swing that thing near me.
1297.89,1299.2,XANDER,I happen to be...
1299.2,1300.97,SPIKE,A glorified bricklayer?
1302.29,1303.73,XANDER,I'm also a swell bowler.
1303.73,1304.81,ANYA,Has his own shoes.
1304.89,1306.93,SPIKE,The gods themselves do tremble.
1306.93,1309.36,BUFFY,"Spike, shut your mouth. Come with me."
1315.05,1317.65,BUFFY,Weapons are by the TV.
1315.05,1317.65,BUFFY,I'll grab the stuff upstairs.
1318.41,1320.24,SPIKE,Buffy...
1324.85,1327.61,SPIKE,If you wannajust hand them
1324.85,1327.61,SPIKE,over the threshold...
1328.29,1330.49,BUFFY,"Come in, Spike."
1339.97,1342.77,SPIKE,Presto. No barrier.
1346.01,1348.08,SPIKE,I won't bother with the small stuff.
1348.17,1353.33,SPIKE,Couple of good axes should hold off Glory's
1348.17,1353.33,SPIKE,mates while you take on the lady herself.
1354.21,1357.13,BUFFY,We're not all gonna make it. You know that?
1358.01,1360.45,SPIKE,Yeah.
1361.77,1364.08,SPIKE,Always knew I'd go down fightin'.
1364.37,1367.73,BUFFY,I'm counting on you to protect her.
1369.21,1372.17,SPIKE,Till the end of the world.
1372.25,1374.45,SPIKE,Even if that happens to be tonight.
1376.21,1378.44,BUFFY,I'll be a minute.
1381.77,1383.92,SPIKE,I know you'll never love me.
1386.81,1389.09,SPIKE,I know that I'm a monster.
1389.17,1392.64,SPIKE,But you treat me like a man. And that's...
1396.05,1398.04,SPIKE,Get your stuff. I'll be here.
1417.85,1419.76,MINION,She will come to you soon.
1431.77,1434.16,BUFFY,We on schedule?
1434.25,1436.29,GILES,"Yes, it's time."
1436.37,1438.36,BUFFY,Will?
1444.49,1446.48,WILLOW,"Tara, baby?"
1447.33,1449.32,WILLOW,Is there somewhere you should be?
1450.89,1453.28,TARA,They held me down.
1453.37,1457.08,WILLOW,"No one's holding you. It's the big day, right?"
1459.45,1461.57,WILLOW,Do you wanna go?
1469.65,1472.45,TARA,You're a killer.
1472.53,1474.52,TARA,This is all set down.
1477.37,1480.76,BUFFY,Stay close but don't crowd her.
1477.37,1480.76,BUFFY,We'll follow in a minute.
1480.85,1485.29,BUFFY,Everybody knows theirjobs.
1480.85,1485.29,BUFFY,"Remember, the ritual starts  we all die."
1486.45,1489.21,BUFFY,And I'll kill anyone who comes near Dawn.
1492.77,1496.13,SPIKE,"Well, not exactly the"
1492.77,1496.13,SPIKE,"St Crispin's Day speech, was it?"
1496.93,1499.41,GILES,We few. We happy few.
1499.41,1501.77,SPIKE,We band of buggered.
1536.81,1538.38,XANDER,Shpedoinkel.
1538.38,1540.09,ANYA,What is that?
1540.37,1542.93,GILES,The portal must open up there.
1543.57,1545.77,BUFFY,"Will, you're up."
1547.25,1549.61,GILES,Need anything?
1549.69,1551.68,WILLOW,Could use a little courage.
1553.41,1555.17,WILLOW,The real kind.
1555.25,1557.85,WILLOW,But thanks.
1576.97,1578.96,GLORY,You. What are you doing here?
1579.81,1584.02,WILLOW,She's with me.
1593.33,1598.02,GLORY,What the frickin' hell did that bitch do to me?
1597.13,1599.25,MINION,You look fine. Truly.
1599.33,1603.88,GLORY,She made a little... She made a hole.
1603.97,1605.49,GLORY,I need a brain to eat.
1605.49,1607.57,MINION,"Take mine, O Groovetastic One."
1607.81,1610.33,GLORY,"I said a brain, you worthless dirt."
1611.65,1616.44,GLORY,Big day. I got places to be.
1611.65,1616.44,GLORY,Big day. Need a brain.
1617.97,1620.69,GLORY,Suppose I could always use yours.
1620.77,1622.76,BUFFY,"OK, then."
1625.41,1626.97,BUFFY,Come and get it.
1635.17,1636.81,BUFFY,You don't seem very well.
1636.89,1640.52,GLORY,Your little witch bitch
1636.89,1640.52,GLORY,gave me kind of a headache there.
1641.41,1643.48,GLORY,But if you think this is gonna last...
1643.61,1647.24,BUFFY,"I notice you're talking, whereas"
1643.61,1647.24,BUFFY,"in your position, I would attack me."
1647.81,1651.33,MINION,"O, Most SweatyNaughtyFeelingsCausing"
1647.81,1651.33,MINION,"One, should we..."
1651.41,1653.29,GLORY,Go guard the girl.
1653.37,1654.63,GLORY,This is a...
1654.63,1656.73,MINION,Diversionary tactic?
1656.81,1659.12,GLORY,Go guard.
1665.29,1668.37,BUFFY,It's strange. You're not
1665.29,1668.37,BUFFY,as blurry with speed as usual.
1668.45,1669.48,GLORY,The witch...
1669.48,1670.6,BUFFY,It's not her.
1671.61,1673.81,BUFFY,Might be this.
1673.89,1678.02,BUFFY,I heard it's supposed to repel you.
1676.09,1679.37,BUFFY,So my guess is you probably
1676.09,1679.37,BUFFY,"shouldn't touch it, either."
1684.05,1686.36,GLORY,You're gonna wish you...
1691.01,1694.05,MINION 1,Stand fast. Kill anyone who dares approach.
1694.13,1697.49,MINION 1,This will be our day of glory.
1697.57,1698.25,MINION 2,Well punned.
1698.25,1699.61,MINION 1,Itjust called out to me.
1738.01,1742.02,WILLOW,Tara.
1753.41,1755.97,TARA,Willow?
1757.41,1759.77,TARA,Tara?
1757.41,1759.77,TARA,Willow...
1761.21,1763.32,TARA,I got so lost.
1763.32,1765.13,WILLOW,I found you.
1768.93,1771.53,WILLOW,I will always find you.
1774.53,1776.21,GLORY,You know what?
1776.89,1780.17,GLORY,I'm feeling a little better.
1776.89,1780.17,GLORY,And now I'm a little bored.
1780.25,1782.56,BUFFY,I'm sorry. Cos you're about...
1786.53,1789.17,GLORY,Wow. The Slayer's a robot.
1789.25,1792.61,GLORY,Did everybody else know
1789.25,1792.61,GLORY,the Slayer was a robot?
1792.69,1794.68,BUFFY,Glory?
1798.81,1801.04,BUFFY,You're not the brightest god in the heavens.
1801.13,1803.97,DAWN,Buffy! I'm up here!
1805.57,1807.64,DAWN,Buffy!
1816.97,1819.04,GLORY,"No, you don't."
1819.13,1821.25,DAWN,Buffy! I'm up here!
1850.41,1852.05,DAWN,Buffy!
1906.37,1910.41,GLORY,"You lost your hammer, sweetcheeks."
1906.37,1910.41,GLORY,What are you gonna hit me with now?
1915.81,1918.45,BUFFY,Whatever's handy.
1921.17,1924.13,XANDER,And the glorified bricklayer picks up a spare.
1926.77,1930.13,ANYA,Has anyone noticed we're going backwards?
1930.13,1931.85,SPIKE,It's crossed my mind.
1933.21,1937.21,GILES,As long as Buffy can keep Glory down
1933.21,1937.21,GILES,"long enough, it doesn't matter."
1937.29,1939.44,GILES,Only a few minutes left to start the ritual.
1947.13,1949.65,DAWN,You. You can help me.
1950.33,1954.49,DAWN,"Untie me. Please. Help me, she's coming."
1954.57,1960.49,DOC,"Well, it seems she's running"
1954.57,1960.49,DOC,"a bit late, is the thing."
1960.57,1964.93,DOC,And if Her Splendidness
1960.57,1964.93,DOC,can't be here in time to bleed you...
1966.09,1969.97,DOC,"Hey, kid. Wanna see a trick?"
1984.69,1985.68,XANDER,How we doing?
1985.68,1987.05,ANYA,So far it's a tie.
1987.37,1990.6,GILES,"We haven't got up to Dawn,"
1987.37,1990.6,GILES,but then neither has anyone else.
1991.41,1992.85,SPIKE,Someone's up there.
1996.17,1997.97,XANDER,"OK, we gotta charge or something."
1997.97,1998.73,ANYA,We tried that.
1998.81,2000.96,WILLOW VOICEOVER,"Spike, can you hear me?"
2000.96,2002.93,SPIKE,"Yeah, loud and clear."
2003.25,2005.75,WILLOW VOICEOVER,Is there someone up there with Dawn?
2005.75,2007.21,SPIKE,"Yeah, can't tell who."
2007.45,2008.84,XANDER,Are you talking to us?
2008.84,2010.17,WILLOW VOICEOVER,Get up there. Go now.
2012.29,2014.2,SPIKE,"Yeah, but..."
2014.2,2014.68,WILLOW VOICEOVER,Go.
2022.77,2027.24,DOC,"Well, what do you know?"
2022.77,2027.24,DOC,It's just about that time.
2027.33,2028.56,DAWN,Spike.
2029.37,2031.73,SPIKE,Doesn't a fella stay dead when you kill him?
2032.17,2034.29,DOC,Look who's talking.
2034.37,2037.49,SPIKE,"Come on, Doc. Let's you and me have a go."
2037.57,2041.85,DOC,I do have a prior appointment.
2042.33,2043.89,SPIKE,This won't take long.
2043.89,2045.96,DOC,"No, I don't imagine it will."
2053.89,2057.65,GLORY,You're just a mortal.
